{"analysisStatus": "ok", "inputType": "url", "url": "https://monday.com", "featuresSchemaVersion": "1.0", "visualTrust": {"analysisStatus": "error", "label": null, "confidence": 0, "probs": null, "error": "image_trust_failed: HTTPStatusError: Server error '503 Service Unavailable' for url 'http://127.0.0.1:8000/api/analyze/image-trust'\nFor more information check: https://developer.mozilla.org/en-US/docs/Web/HTTP/Status/503"}, "features": {"featuresSchemaVersion": "1.0", "visual": {"hero_headline": null, "subheadline": null, "primary_cta_text": null, "primary_cta_position": null, "has_pricing": null, "has_testimonials": null, "has_logos": null, "has_guarantee": null, "has_faq": null, "has_security_badges": null, "visual_clutter_level": null, "cta_contrast_level": null, "info_hierarchy_quality": null, "secondary_cta_text": null, "secondary_cta_position": null, "hero_media_type": null, "color_palette_comment": null, "layout_style": null, "noted_elements": null}, "text": {"key_lines": ["monday.com | The AI work platform", "Skip to main content", "Products", "Solutions", "Resources", "Enterprise", "Pricing", "Log in", "Request a demo", "Get Started"], "offers": ["No credit card needed \u2726 Unlimited time on Free plan", "Trusted by over 60% of the Fortune 500", "$4M saved", "Free your teams from data entry to focus on sales and nurture, with AI actions and code-free automations.", "300%", "saved", "\"With monday service, 98% of our tickets are automatically categorized and assigned by AI. We resolve each 6-7 mins faster.\"", "28%", "11% efficiency", "Learn more about monday's AI offering"], "claims": ["Trusted by over 60% of the Fortune 500", "Leadership"], "risk_reversal": [], "audience_clarity": "monday.com | The AI work platform", "cta_copy": null, "pricing_mentions": ["Pricing", "Pricing", "No credit card needed \u2726 Unlimited time on Free plan", "Deliver projects on time with AI-powered planning and risk visibility.", "Streamline operations with AI that manages logistics, resources, and planning at scale.", "Ship quality software faster with AI-optimized sprints and roadmap planning.", "$4M saved", "per month", "Plan roadmaps, execute sprints, and ship with precision using AI-powered guidance.", "per month", "Plans sprints, assigns work, and flags blockers."], "proof_points": ["with clients to nurture key relationships."], "differentiators": []}, "meta": {"url": "https://monday.com", "timestamp": "2025-12-14T20:40:56.551058", "screenshot_bytes": 126323}}, "brain": {"frictionScore": 50.0, "trustScore": 50.0, "clarityScore": 70.0, "decisionProbability": 0.58, "keyDecisionBlockers": [{"name": "weak_cta_copy", "evidence": ["CTA copy unclear"], "severity": "medium", "fix": "Add a primary CTA with a clear next action."}], "recommendedQuickWins": [], "recommendedDeepChanges": [], "confidence": 0.17}, "extractedText": "monday.com | The AI work platform\nSkip to main content\nProducts\nSolutions\nResources\nEnterprise\nPricing\nLog in\nRequest a demo\nGet Started\nProducts\nTailored to your teams' needs\nmonday work management\nmonday CRM\nmonday campaigns\nmonday dev\nmonday service\nMore by monday.com\nWorkForms\nWorkCanvas\nTeams\nBy team\nMarketing\nProject management\nSales\nProduct development\nOperations\nIT\nHR\nBy business size\nEnterprise\nSmall business\nNonprofit\nBy industry\nRetail\nMedia\nConstruction\nGovernment\nFeatures\nDashboards\nIntegrations\nAutomations\nAI\nKanban\nDocs\nGantt\nForms\nResources\nLearn\nHelp center\nWhat's new\nAbout us\nBlog\nCertifications\nConnect\n24/7 support\nPartners\nGlobal events\nCommunity\nBuild\nApp development\nTemplate center\nSpaces\nDiscover AI\nAI overview\nmonday MCP\nAI Trust center\nPricing\nRequest a demo\nLog in\nGo to homepage\nFrom managing work,\nto doing the work for you\nAgentic AI products that deliver results across projects, marketing, sales, operations, and engineering.\nGet Started\nNo credit card needed \u2726 Unlimited time on Free plan\nWhere would you like to start?\nProjects\nMarketing\nSales\nOperations\nSoftware\nSupport & IT\nRecommended product\nDeliver projects on time with AI-powered planning and risk visibility.\nGet Started\nPart of the monday product suite\nRecommended product\nRun high-impact campaigns with AI that drives execution, insights, and performance.\nGet Started\nPart of the monday product suite\nRecommended product\nAccelerate revenue growth with the AI-first CRM that finds and enriches leads.\nGet Started\nPart of the monday product suite\nRecommended product\nStreamline operations with AI that manages logistics, resources, and planning at scale.\nGet Started\nPart of the monday product suite\nRecommended product\nShip quality software faster with AI-optimized sprints and roadmap planning.\nGet Started\nPart of the monday product suite\nRecommended product\nDeliver standout service with AI-powered ticket handling and incident support.\nGet Started\nPart of the monday product suite\nTrusted by over 60% of the Fortune 500\nSolutions for every team. Powered by one platform.\nProjects\nSales\nMarketing\nIT & Ops\nProduct & Engineering\nLeadership\nDrive execution at scale\nDeliver projects, programs, and portfolios with full resource visibility and AI-powered risk detection.\nGet Started\n$4M saved\nwith optimized processes\n\u201cmonday.com gives us the visibility to get everyone on the same page and track all the moving parts of our projects.\u201d\nJason Doan\nVP of Operations, HOLT CAT\nAccelerate revenue growth\nFree your teams from data entry to focus on sales and nurture, with AI actions and code-free automations.\nGet Started\n18x\nROI achieved\ninthe first year\n\u201cAs a VP, trying to look at a 30,000-ft view, I can see the percentage of successful opportunities and know-how to analyze the market.\u201d\nChristopher Stone\nVP Business Development, KC Petroleum\nAmplify marketing impact\nAlign marketing around shared goals with AI that streamlines briefs, flags delays, and drives campaign impact.\nGet Started\n300%\nincrease in creative output\n\u201cmonday.com isn\u2019t just another tool in the mix, but a work operating system that supports our need for efficiency at scale.\u201d\nVic Diesta\nCreative Operations Lead, Canva\nScale exceptional service\nEmpower teams to resolve requests faster with AI that triages, routes, and guides each issue to resolution.\nGet Started\n55 hours\nsaved\nper month\n\"With monday service, 98% of our tickets are automatically categorized and assigned by AI. We resolve each 6-7 mins faster.\"\nClive Camilleri\nHead of People & Ops, Zopa Bank\nLaunch quality products faster\nPlan roadmaps, execute sprints, and ship with precision using AI-powered guidance.\nGet Started\n28%\nfaster time\nto market\n\"monday dev ensures clear alignment between what we\u2019re building and market demand. Does it help us move faster? Without a doubt.\"\nAlan Schmoll\nExecutive VP, Vistra Platform\nLead with clear foresight\nKeep strategic goals on track with AI risk flagging and cross-org data to make real-time decisions.\nGet Started\n11% efficiency\ngained\nper month\n\u201cNow in real-time, we can identify health metrics and risks, whether they\u2019re coming from our side or the client side.\u201d\nPaul Willie\nCOO, VML\nSolve work challenges\nwith AI-first products\nEach product solves departmental needs, and together, they power seamless operations across your organization.\nGet Started\nRequest a demo\nDrive projects and processes forward with AI insights\nLearn more\nDrive projects and processes forward with AI insights\nAI-powered risk identification\nUse AI to flag risks early to make informed decisions across your entire portfolio.\nProject and portfolio management\nGain visibility into risks and dependencies to ensure fast and precise project delivery.\nResource management\nUse AI to assign the right people to every project based on skills, availability, and real-time capacity.\nGet Started\nAutomate full customer journeys with AI actions\nLearn more\nAutomate full customer journeys with AI actions\nAI deal prioritization\nScore deal health and close probability with monday CRM, so teams can focus on converting.\nConnected communication\nCentralize outreach, lead activity, and performance analytics, so nothing falls through the cracks.\nPost-sales & account management\nMonitor account health, communicate and engage\nwith clients to nurture key relationships.\nGet Started\nSales\nEngineering\nIT\nMarketing\nShip quality software with AI-guided sprints\nLearn more\nShip quality software with AI-guided sprints\nAI developer assistance\nResolve bugs and incidents faster with AI-surfaced context on related code, tasks, and documentation.\nMulti-method execution\nRun sprints with Scrum, Kanban, or hybrid methods to move faster without admin blocks.\nAgile insights\nGet real-time metrics like cycle time and sprint\nvelocity to ensure predictable delivery.\nGet Started\nDeliver standout service with AI ticket handling\nLearn more\nDeliver standout service with AI ticket handling\nAI ticket triage\nAutomatically categorize, prioritize, and route tickets\nwith AI to speed up resolution times.\nAI ticket resolutions\nResolve repetitive requests instantly with AI-powered auto-replies based on past cases.\nCustomer portal\nLaunch a dynamic portal for users to submit requests, track tickets, and access self-serve resources.\nGet Started\nYour teams\u2019 impact. Multiplied by AI.\nLearn more about monday's AI offering\nPredict risks early\nScale marketing output\nBoost sales velocity\nResolve tickets faster\nDrive quality sprints\nYour browser does not support the video tag.\nYour browser does not support the video tag.\nYour browser does not support the video tag.\nYour browser does not support the video tag.\nYour browser does not support the video tag.\nComing soon\nMeet your AI assistants\nDescribe the job. Your custom AI assistant is created, ready to work 24/7.\nSDR Expert\nProactively sources, enriches, and scores new leads, 24/7.\nCompetitor Analyzer\nGenerates market research and trend reports, daily.\nmonday sidekick\nJust ask. The assistant handles your work for you.\nProject Assistant\nFlags risks and automates project processes, in real time.\nService Agent\nAutomatically triages and resolves support tickets.\nScrum Master\nPlans sprints, assigns work, and flags blockers.\nGet Started\nVisit our AI Trust Center\nThe monday.com difference\nYour browser does not support the video tag.", "debugScreenshotPath": "N:\\nima-ai-marketing\\api\\debug_shots\\shot_20251214_234055.png", "debugScreenshotBytes": 126323, "error": null}